{
  "kind": "selfhelp-frontend-release",
  "id": "selfhelp-frontend-0.1.0",
  "version": "0.1.0",
  "channel": "stable",
  "image": "ghcr.io/humdek-unibe-ch/selfhelp-frontend:0.1.0",
  "digest": "sha256:4444444444444444444444444444444444444444444444444444444444444444",
  "builtFrom": {
    "nextStandalone": true,
    "sharedPackageVersion": "1.4.0"
  },
  "backendCompatibility": {
    "requiredCoreRange": ">=0.1.0 <0.2.0",
    "requiredApiVersion": "0.1.0"
  },
  "security": {
    "signature": "hjgXkKMvIDqukQuPv4C3jNosIEZZ6A00l9XqkPDDXpJpdFRD2utz8uOkPag3OKnQvStg6ZBWe9qYHwMzij24Bw==",
    "keyId": "prod",
    "signedPayloadSha256": "sha256:6e2ac70ea81ad8ed0a966d5d9ab19c0065f0fbdc66885afc3c199aea8e8c04a0"
  }
}
